{
  "id": "CVE-2024-12345",
  "details": {
    "vulnerability_name": "Sample Vulnerability",
    "vulnerability_description": "This vulnerability allows remote attackers to execute arbitrary code.",
    "cve_cvss_score": 7.5,
    "product": "Sample Product",
    "vendor": "Sample Vendor",
    "published_to_nist_nvd": true
  },
  "timeline": {
    "cve_published_date": "2024-01-01",
    "cve_last_updated_date": "2024-01-02",
    "first_known_published_date": "2024-01-01",
    "cisa_kev_date_added": "2024-01-03"
  },
  "exploitation_details": {
    "attack_vector": "Network",
    "exploit_found": true,
    "exploitation_registered_in_kev": true,
    "epss_score": 0.8
  }
}